Experience,Qualifications,Work Type,Job Title,Role,Job Description,skills
5 to 10 Years,BBA,Contract,Procurement Manager,Supplier Diversity Manager,"Promote diversity and inclusion in the supply chain, manage supplier diversity programs, and assess supplier performance.",Supplier diversity programs Diversity and inclusion initiatives Supplier assessment and certification Data collection and reporting Vendor outreach and engagement Strategic planning Communication skills Relationship building Attention to diversity and inclusion principles
0 to 12 Years,MBA,Part-Time,Architectural Designer,Architectural Drafter,Architectural Drafters assist architects and engineers in creating detailed technical drawings and plans for buildings and structures. They use computer-aided design (CAD) software to produce accurate and precise architectural drawings.,Architectural drafting AutoCAD 2D and 3D modeling Blueprint reading Building codes Collaboration with architects Detail-oriented
0 to 11 Years,M.Com,Full-Time,Art Teacher,Art Education Coordinator,"An Art Education Coordinator plans and manages art education programs, curriculum development, and educational outreach to promote art appreciation and learning within communities.",Art education curriculum Program development Teacher training Communication skills Artistic expertise
5 to 12 Years,B.Com,Temporary,Environmental Consultant,Environmental Impact Analyst,"Environmental Impact Analysts assess the environmental consequences of projects or activities. They conduct studies, analyze data, and provide recommendations to minimize adverse environmental effects and promote sustainable practices.",Environmental impact analysis Data collection and analysis Environmental regulations Reporting GIS (Geographic Information Systems) Technical writing
4 to 13 Years,BCA,Temporary,Art Teacher,Art Education Coordinator,"An Art Education Coordinator plans and manages art education programs, curriculum development, and educational outreach to promote art appreciation and learning within communities.",Art education curriculum Program development Teacher training Communication skills Artistic expertise
5 to 10 Years,MBA,Contract,Event Planner,Wedding Planner,"Wedding Planners specialize in organizing weddings, assisting couples with every aspect of wedding planning, from venue selection to catering and decor.",Wedding planning Venue selection Catering and menu planning Floral and decor design Wedding etiquette
3 to 11 Years,M.Com,Contract,Architect,Architectural Designer,"Architectural Designers create architectural plans and designs for buildings and structures, considering aesthetics, functionality, and safety standards.","Architectural design software (e.g., AutoCAD, Revit) Building codes and regulations 3D modeling Visualization Sustainable design"
5 to 14 Years,BA,Contract,Family Lawyer,Mediator,Mediators facilitate negotiations and dispute resolution between parties in conflict. They remain neutral and help parties reach mutually acceptable agreements through effective communication and problem-solving techniques.,Mediation Conflict resolution Negotiation Communication skills Neutrality Problem-solving Legal knowledge Mediation techniques
5 to 12 Years,PhD,Temporary,Account Manager,Client Relationship Manager,"Build and maintain strong client relationships, understand their needs, and ensure client satisfaction.",Client relationship management Customer service Communication skills
4 to 8 Years,BBA,Part-Time,Business Development Manager,Market Expansion Manager,"A Market Expansion Manager strategizes and executes plans to expand the companys presence in new markets, identifying growth opportunities and optimizing market penetration.",Market expansion strategies Market research Sales planning and execution
1 to 14 Years,BBA,Contract,Network Engineer,Network Administrator,"Network Administrators manage an organizations computer networks. They configure, monitor, and maintain network infrastructure, ensuring optimal performance and security.","Network management Troubleshooting Network security IT certifications (e.g., CCNA)"
5 to 14 Years,BCA,Contract,IT Manager,Infrastructure Manager,"An Infrastructure Manager is responsible for the operation and maintenance of an organizations IT infrastructure, including servers, networks, and data centers.","Network administration System administration Virtualization technologies (e.g., VMware, Hyper-V) Storage management IT security Disaster recovery planning Capacity planning Monitoring and troubleshooting Cloud infrastructure (e.g., AWS, Azure) Vendor management"
0 to 15 Years,BCA,Contract,HR Coordinator,Training Coordinator,"Training Coordinators design and implement employee training programs. They assess training needs, develop training materials, and facilitate training sessions to enhance employees skills and knowledge.",Training program coordination Training material development Learning management systems
5 to 12 Years,B.Tech,Part-Time,Human Resources Manager,Employee Relations Specialist,"Employee Relations Specialists focus on maintaining positive relationships between employees and the organization. They address workplace issues, conduct investigations, mediate conflicts, and promote a healthy and productive work environment.",Employee conflict resolution HR compliance Employee engagement Communication skills
5 to 11 Years,BCA,Full-Time,Customer Support Specialist,Help Desk Analyst,"Help Desk Analysts provide technical support and assistance to internal employees or external customers. They troubleshoot hardware and software issues, offer solutions, and document support interactions to maintain a reliable IT environment.",Help desk support Ticket resolution IT troubleshooting Customer service skills Technical knowledge Documentation and knowledge base maintenance Communication and interpersonal skills
3 to 12 Years,BCA,Contract,Content Writer,Content Strategist,"Content Strategists develop and execute content strategies that align with business objectives. They plan content creation, distribution, and promotion to engage audiences and drive brand growth.",Content strategy Content planning SEO optimization Content marketing Analytics
1 to 14 Years,B.Com,Part-Time,Network Administrator,Network Security Analyst,"Protect an organizations computer networks and systems from security threats, monitor network traffic, and respond to incidents.",Network security protocols Intrusion detection and prevention Security incident response Firewall administration Vulnerability assessment Security policies and procedures Log analysis Ethical hacking Problem-solving Communication skills Attention to detail
1 to 14 Years,B.Tech,Full-Time,Chemical Analyst,Quality Control Analyst,"In the role of a Quality Control Analyst, you will be responsible for inspecting and testing products to ensure they meet quality standards and specifications. You will use quality control tools and processes to identify defects, document findings, and recommend improvements. Your role is essential in maintaining product quality and customer satisfaction.",Quality control Quality assurance QC testing methods Compliance standards Root cause analysis Documentation Statistical analysis
1 to 11 Years,BCA,Full-Time,Psychologist,Clinical Psychologist,"Clinical Psychologists diagnose and treat mental health disorders. They conduct therapy sessions, assessments, and research to improve patients well-being.",Clinical psychology Counseling skills Assessment tools Diagnostic skills Empathy and listening skills
2 to 14 Years,M.Com,Contract,Software Engineer,Backend Developer,"A Backend Developer is tasked with building and maintaining the server-side logic and database infrastructure of web applications. They work on the core functionality, data storage, and server communication to ensure the application runs smoothly and efficiently.","Proficiency in one or more backend programming languages (e.g., Java, Python, Node.js, Ruby) API development Database management (SQL or NoSQL) Server management and deployment Security best practices Knowledge of web frameworks (e.g., Express, Django)"
4 to 11 Years,MBA,Contract,Physician Assistant,Primary Care Physician Assistant,"Provide medical care under the supervision of physicians, conduct examinations, diagnose and treat patients.",Medical knowledge and clinical skills Patient care and assessment Communication and empathy
4 to 13 Years,MCA,Full-Time,Financial Advisor,Investment Advisor,"Investment Advisors offer financial advice to clients, helping them make investment decisions, manage portfolios, and achieve their financial goals.",Investment strategies Portfolio management Financial planning Risk assessment Regulatory compliance
5 to 14 Years,MBA,Temporary,Litigation Attorney,Trial Attorney,"Trial Attorneys represent clients in legal proceedings. They prepare cases, conduct trials, and provide legal counsel to clients involved in civil or criminal litigation.",Litigation Legal research Courtroom representation Case preparation Client counseling Legal writing
5 to 10 Years,BBA,Contract,Front-End Developer,Web Designer,"A Web Designer specializes in designing visually appealing and responsive websites. They create layouts, graphics, and user interfaces to enhance the online presence of businesses.","Web design concepts Graphic design software (e.g., Adobe Creative Suite) HTML and CSS Responsive design User interface (UI) principles Visual communication Typography Color theory Creativity Attention to detail Collaboration"
4 to 13 Years,BCA,Full-Time,IT Support Specialist,Help Desk Support Specialist,"Help Desk Support Specialists provide technical assistance and support to end-users, resolving IT issues and ensuring smooth operations.",Technical troubleshooting Customer service and communication Ticketing system usage Basic IT knowledge Problem-solving and critical-thinking skills
3 to 15 Years,BA,Part-Time,Paralegal,Litigation Paralegal,"Assist in litigation cases, including document preparation, legal research, and trial support.",Legal research Discovery management Case preparation Trial support Document review Client communication E-filing Attention to detail Multitasking Legal terminology Technology proficiency Communication skills Legal software proficiency
1 to 13 Years,BBA,Contract,Legal Counsel,Corporate Attorney,"Corporate Attorneys provide legal counsel and representation to organizations. They handle legal matters, contracts, mergers, acquisitions, and ensure compliance with laws and regulations relevant to the business.",Corporate law and regulations Contract drafting and negotiation Legal research and analysis Risk management Excellent communication and negotiation skills
1 to 15 Years,B.Tech,Intern,Art Teacher,Art Education Coordinator,"An Art Education Coordinator plans and manages art education programs, curriculum development, and educational outreach to promote art appreciation and learning within communities.",Art education curriculum Program development Teacher training Communication skills Artistic expertise
2 to 13 Years,MBA,Temporary,UX/UI Designer,User Interface Designer,"User Interface Designers focus on the visual and interactive aspects of digital interfaces. They design layouts, buttons, and other elements to ensure a cohesive and visually appealing user interface.","UI design principles and best practices Graphic design tools (e.g., Adobe Photoshop, Illustrator) Typography and color theory Visual design and layout Responsive design"
1 to 9 Years,B.Tech,Full-Time,Social Media Coordinator,Content Creator,"Create engaging and relevant content, such as articles, videos, or social media posts, to promote brands or products.","Content creation (e.g., writing, editing, graphic design, video production) Content marketing Social media management SEO optimization Creative storytelling Audience engagement Analytics and reporting Adaptability Communication skills Creativity"
2 to 12 Years,M.Com,Intern,Tax Consultant,Business Tax Consultant,"A Business Tax Consultant specializes in tax planning and compliance for businesses. They assist with tax strategy, filings, and help organizations minimize tax liabilities.",Business tax law knowledge Corporate tax planning Tax compliance for businesses Tax credits and incentives Tax strategy development Financial analysis IRS regulations Client relationship management Communication skills Tax software proficiency
1 to 8 Years,M.Tech,Temporary,Electrical Designer,Electrical Engineer,"Electrical Engineers design and develop electrical systems and devices. They work on projects such as power generation, electronics, and control systems for various industries.",Electrical engineering Circuit design Electronics AutoCAD proficiency Problem-solving
5 to 11 Years,MCA,Temporary,UX Researcher,User Researcher,"Conduct user research to understand customer needs, preferences, and behaviors to inform product development.",User research methods Usability testing Data analysis and interpretation
2 to 14 Years,BCA,Temporary,Systems Administrator,IT Support Specialist,"IT Support Specialists provide technical assistance to end-users, troubleshooting hardware and software problems, setting up equipment, and maintaining IT infrastructure.",Technical troubleshooting Hardware and software support Customer service Problem-solving Communication
4 to 15 Years,M.Tech,Contract,Systems Administrator,IT Support Specialist,"IT Support Specialists provide technical assistance to end-users, troubleshooting hardware and software problems, setting up equipment, and maintaining IT infrastructure.",Technical troubleshooting Hardware and software support Customer service Problem-solving Communication
0 to 15 Years,M.Com,Intern,Customer Service Manager,Service Quality Assurance Manager,"Service Quality Assurance Managers monitor and evaluate service quality in an organization. They develop quality standards, conduct audits, analyze customer feedback, and implement improvements to ensure consistent high-quality service delivery.",Quality assurance Quality control Process improvement Audit procedures Compliance standards Root cause analysis
4 to 15 Years,PhD,Intern,Network Administrator,Network Security Analyst,"Protect an organizations computer networks and systems from security threats, monitor network traffic, and respond to incidents.",Network security protocols Intrusion detection and prevention Security incident response Firewall administration Vulnerability assessment Security policies and procedures Log analysis Ethical hacking Problem-solving Communication skills Attention to detail
1 to 8 Years,BA,Intern,UI Developer,UX/UI Designer,A UX/UI Designer focuses on enhancing user experiences by designing intuitive interfaces. They consider user needs and preferences to create visually appealing and functional designs.,User experience (UX) design User interface (UI) design Wireframing and prototyping Usability testing Design tools like Sketch or Figma
2 to 15 Years,M.Tech,Intern,Legal Counsel,Employment Lawyer,"Employment Lawyers focus on employment law matters, assisting employers and employees with issues like workplace discrimination, labor disputes, and employment contracts. They offer legal counsel and represent clients in legal proceedings.",Employment law and regulations Employment contracts and agreements Workplace discrimination and harassment laws Legal compliance Client representation and advocacy
0 to 8 Years,M.Com,Intern,Sales Associate,Retail Sales Associate,"A Retail Sales Associate assists customers in retail environments, helping them find products, providing product information, and ensuring a positive shopping experience.",Customer service Sales techniques Product knowledge Cash handling Communication skills
0 to 9 Years,MBA,Part-Time,Mechanical Engineer,Manufacturing Engineer,"Manufacturing Engineers optimize manufacturing processes, improve production efficiency, and ensure product quality in manufacturing environments.",Manufacturing processes knowledge CAD/CAM software proficiency Lean manufacturing principles Quality control and assurance Six Sigma certification
5 to 10 Years,B.Com,Full-Time,HR Manager,Human Resources Director,"A Human Resources Director leads HR functions, including talent acquisition, employee development, and HR strategy, to promote a positive work environment and support organizational goals.",Strategic HR planning Employee relations Talent management HR policy development Leadership skills
4 to 9 Years,BA,Part-Time,Environmental Engineer,Sustainability Specialist,"A Sustainability Specialist promotes sustainability initiatives within organizations, develops sustainability programs, and helps reduce environmental impacts while increasing efficiency.",Sustainability practices Environmental management systems Green certifications
2 to 11 Years,B.Com,Intern,Litigation Attorney,Corporate Litigator,"Corporate Litigators specialize in corporate law. They handle legal matters related to businesses, such as mergers, acquisitions, contracts, and disputes, to protect corporate interests.",Corporate law Commercial litigation Dispute resolution Contract law Legal strategy Negotiation
1 to 10 Years,MCA,Contract,Office Manager,Administrative Manager,"Administrative Managers oversee office operations. They manage administrative staff, coordinate tasks, and ensure smooth office functioning to support the organizations goals.",Administrative leadership Office management Staff supervision Budgeting and financial management Process improvement Communication skills
3 to 8 Years,B.Tech,Temporary,UX/UI Designer,Interaction Designer,Interaction Designers specialize in designing user interactions within digital interfaces. They create meaningful and engaging user experiences by considering user behaviors and system responses.,Interaction design principles User behavior and psychology Wireframing and prototyping tools Animation and micro-interaction design Collaborative design processes
0 to 8 Years,M.Com,Part-Time,Network Engineer,Network Security Engineer,"Network Security Engineers focus on protecting network systems from cyber threats. They implement security measures, monitor network traffic, and respond to security incidents to safeguard the organizations data.",Network security protocols and technologies Firewalls and intrusion detection systems Vulnerability assessment and penetration testing Security policy development and enforcement Incident response and recovery
2 to 14 Years,BCA,Intern,Marketing Analyst,Digital Marketing Analyst,"Analyze digital marketing campaigns, track performance metrics, and optimize online marketing strategies.",Digital marketing strategies Analytics and reporting SEO and SEM Social media marketing Email marketing Data interpretation Marketing automation tools A/B testing Communication skills Problem-solving Attention to detail Marketing knowledge
4 to 8 Years,B.Com,Temporary,Network Analyst,Network Performance Analyst,"Network Performance Analysts monitor and optimize network performance. They collect and analyze network data, identify issues, and implement solutions to enhance network speed, reliability, and efficiency.","Network performance analysis Network monitoring tools (e.g., Wireshark) Troubleshooting Capacity planning Data analysis Network protocols"
2 to 12 Years,PhD,Contract,Account Manager,Client Relationship Manager,"Build and maintain strong client relationships, understand their needs, and ensure client satisfaction.",Client relationship management Customer service Communication skills
1 to 14 Years,M.Com,Part-Time,Civil Engineer,Structural Engineer,"A Structural Engineer designs and analyzes the structural integrity of buildings, bridges, and other structures. They ensure safety and compliance with engineering standards.","Structural engineering principles Structural analysis and design software (e.g., AutoCAD, SAP2000) Building codes and standards Project management Structural integrity assessment"
1 to 13 Years,PhD,Full-Time,Digital Marketing Specialist,Social Media Manager,"Social Media Managers oversee an organizations social media presence. They create and schedule content, engage with followers, and analyze social media metrics to drive brand awareness and engagement.","Social media platforms (e.g., Facebook, Twitter, Instagram) Content creation and scheduling Social media analytics and insights Community engagement Paid social advertising"
3 to 13 Years,BCA,Full-Time,Landscape Architect,Residential Landscape Designer,Create aesthetically pleasing and functional landscape designs for residential properties.,Landscape design Plant selection and care Hardscape design
1 to 14 Years,M.Com,Temporary,Digital Marketing Specialist,Social Media Manager,"Social Media Managers oversee an organizations social media presence. They create and schedule content, engage with followers, and analyze social media metrics to drive brand awareness and engagement.","Social media platforms (e.g., Facebook, Twitter, Instagram) Content creation and scheduling Social media analytics and insights Community engagement Paid social advertising"
3 to 15 Years,B.Com,Temporary,Legal Secretary,Court Clerk,"A Court Clerk manages administrative tasks within a court system, including maintaining court records, scheduling hearings, and assisting judges and legal professionals as needed.",Knowledge of court procedures Legal document management Attention to detail Computer literacy Organization skills
5 to 9 Years,MCA,Full-Time,Financial Analyst,Investment Analyst,"Investment Analysts analyze financial data and market trends to make informed investment recommendations. They research and assess investment opportunities, create financial models, and provide insights to guide investment decisions and portfolio management.",Financial analysis Investment evaluation Portfolio management Data analysis
2 to 9 Years,MCA,Contract,Family Lawyer,Mediator,Mediators facilitate negotiations and dispute resolution between parties in conflict. They remain neutral and help parties reach mutually acceptable agreements through effective communication and problem-solving techniques.,Mediation Conflict resolution Negotiation Communication skills Neutrality Problem-solving Legal knowledge Mediation techniques
1 to 12 Years,BCA,Part-Time,Marketing Analyst,Data Analyst,"Analyze data sets, generate insights, and provide data-driven recommendations to inform business decisions.","Data analysis tools (e.g., SQL, Python) Data visualization tools (e.g., Tableau, Power BI) Statistical analysis Data cleansing and transformation Data modeling Communication of data insights Problem-solving Attention to detail Business acumen"
0 to 14 Years,BA,Contract,Veterinarian,Exotic Animal Veterinarian,"Provide medical care and treatment to exotic animals, diagnose illnesses, perform surgeries, and educate owners on animal care.",Exotic animal medicine Exotic animal diagnostics Specialized surgical skills Avian medicine Reptile care Amphibian care Exotic animal anesthesia Compassion and empathy Client communication Problem-solving Attention to detail
0 to 9 Years,BBA,Temporary,Software Tester,Automation Tester,An Automation Tester uses automated testing tools to verify the functionality and performance of software applications. They create and execute automated test scripts.,"Test automation tools (e.g., Selenium, Appium) Scripting languages (e.g., Python, Java) Test framework development Continuous integration tools Test data management"
4 to 8 Years,BA,Intern,Network Administrator,Network Security Analyst,"Protect an organizations computer networks and systems from security threats, monitor network traffic, and respond to incidents.",Network security protocols Intrusion detection and prevention Security incident response Firewall administration Vulnerability assessment Security policies and procedures Log analysis Ethical hacking Problem-solving Communication skills Attention to detail
4 to 11 Years,BA,Intern,UX/UI Designer,Interaction Designer,Interaction Designers specialize in designing user interactions within digital interfaces. They create meaningful and engaging user experiences by considering user behaviors and system responses.,Interaction design principles User behavior and psychology Wireframing and prototyping tools Animation and micro-interaction design Collaborative design processes
5 to 15 Years,MBA,Part-Time,Project Coordinator,Construction Project Coordinator,"Construction Project Coordinators assist in managing construction projects, handling documentation, budget tracking, and coordinating subcontractors.",Construction project management Building codes and regulations knowledge Budgeting and cost control Construction scheduling Contractor and subcontractor coordination
3 to 9 Years,MCA,Intern,Marketing Analyst,Data Analyst,"Analyze data sets, generate insights, and provide data-driven recommendations to inform business decisions.","Data analysis tools (e.g., SQL, Python) Data visualization tools (e.g., Tableau, Power BI) Statistical analysis Data cleansing and transformation Data modeling Communication of data insights Problem-solving Attention to detail Business acumen"
5 to 12 Years,M.Tech,Intern,QA Analyst,Automation Test Engineer,Automation Test Engineers develop automated test scripts and frameworks to streamline and enhance the testing process. They focus on automating repetitive tests to improve efficiency and maintain test consistency.,"Test automation Test framework development Continuous integration Scripting languages (e.g., Python) Test reporting Code review"
